spec,statusCode,scenario
"{\"spec\": {\"owner\": {},\"secret\": \"R15hoiDIq8Nxu/lY4mPO3DwAVIfU5W7OI+efsB607mLgHTnVW5XJGVqX2ysDx987\",\"display_name\": \"CI kafka access key\",\"description\": \"This API key provides kafka access to cluster x\",\"resource\": {}},\"api_version\": \"iam/v2\",\"kind\": \"ApiKey\",\"id\": \"dlz-f3a90de\",\"metadata\": {\"self\": {},\"resource_name\": {},\"created_at\": {\"value\": \"<Error: Too many levels of nesting to fake this schema>\"},\"updated_at\": {\"value\": \"<Error: Too many levels of nesting to fake this schema>\"},\"deleted_at\": {\"value\": \"<Error: Too many levels of nesting to fake this schema>\"}}}",202,Successful responses: Accepted
"{\"errors\": [{\"id\": \"ed42afdc-f0d5-4c0d-b428-9fc6ed6e279d\",\"status\": \"400\",\"code\": \"invalid_filter\",\"title\": \"Invalid Filter\",\"detail\": \"The 'delorean' resource can't be filtered by 'num_doors'\",\"source\": {\"parameter\": \"num_doors\"}}]}",400,Client error responses: Bad Request
"{\"errors\": [{\"id\": \"ed42afdc-f0d5-4c0d-b428-9fc6ed6e279d\",\"status\": \"401\",\"code\": \"user_unauthenticated\",\"title\": \"Authentication Required\",\"detail\": \"Valid authentication credentials must be provided\"}]}",401,Client error responses: Unauthorized
"{\"errors\": [{\"id\": \"ed42afdc-f0d5-4c0d-b428-9fc6ed6e279d\",\"status\": \"402\",\"code\": \"quota_exceeded\",\"title\": \"Kafka Clusters Per Org Quota Exceeded\",\"detail\": \"The request would exceed the quota: kafka_clusters_per_environment\"}]}",402,Client error responses: Payment Required
"{\"errors\": [{\"id\": \"ed42afdc-f0d5-4c0d-b428-9fc6ed6e279d\",\"status\": \"403\",\"code\": \"user_unauthorized\",\"title\": \"User Access Unauthorized\",\"detail\": \"The user 'mcfly' is not allowed to access the 'delorean' resource without the 'plutonium' role.\"}]}",403,Client error responses: Forbidden
"{\"errors\": [{\"id\": \"ed42afdc-f0d5-4c0d-b428-9fc6ed6e279d\",\"status\": \"409\",\"code\": \"resource_already_exists\",\"title\": \"Resource Already exists\",\"detail\": \"The entitlement '91e3e86f-fca6-4f14-98f5-a48e64113ce2' already exists.\"}]}",409,Client error responses: Conflict
"{\"errors\": [{\"status\": \"422\",\"code\": \"invalid_configuration\",\"id\": \"ed42afdc-f0d5-4c0d-b428-9fc6ed6e279d\",\"title\": \"Validation Failed\",\"detail\": \"The property '/cluster/storage_size' of type string did not match the following type: integer\",\"source\": {\"pointer\": \"/cluster/storage_size\"}}]}",422,Client error responses: Unprocessable Entity
"{\"errors\": [{\"id\": \"ed42afdc-f0d5-4c0d-b428-9fc6ed6e279d\",\"status\": \"500\",\"code\": \"out_of_gas\",\"title\": \"DeLorean Out Of Gas\",\"detail\": \"The DeLorean has run out of gas, but Doc Brown will fill 'er up for you asap\"}]}",500,Server error responses: Internal Server Error